topic_id	ref_id	s1	s2	anno_1	anno_2	anno_average
1	1.3.7	Soziale Medien ermöglichen den Unterricht, winkungsvoller für die Klasse zu sein	Angst vor Ablenkung ist nicht begündet, da auch Bücher ablenken können	0	0	0
1	1.4.1	Viele Lehrer haben noch Angst vor der Nutzung von sozialen Netzwerken im Unterricht, da sie eine Zerstreuung befürchten - viele sind mit solchen Werkzeugen nämlich gar nicht vertraut, und eine Umstrukturierung, vor allem im hohen Alter, könnte einen riesigen Aufwand darstellen.	Schüler:innen können leicht abgelenkt werden	1	2	1.5
1	1.3.1	Soziale Medien sind näher am Lebensalltag der Schüler	Unterricht ist abwechslungsreicher	0	0	0
1	1.3.5	Stille Schüler trauen sich mehr	Pädagogen raten zur Auseinandersetzung mit dem medialen Wandel	0	0	0
1	1.3.2	Soziale Netzwerke machen den Unterricht spannender und abwechslungsreicher, und Schüler behalten den Stoff deswegen besser bei	Unterricht bleibt länger im Gedächtnis	2	2	2
1	1.3.4	Die Medien müssen nicht die Ursache für die mangelnde Aufmerksamkeit der Schüler während des Unterrichts sein.	Auch schüchterne Schüler:innen werden ermutigt, ihre Meinungen zu äußern	0	0	0
1	1.2.1	Ihre Einstellung zum Thema ist äußerst positiv	Autor befürwortet die Nutzung von Twitter im Unterricht	2	1	1.5
1	1.3.1	Außerdem trägt man dadurch dazu bei, dass sich soziale Netzwerke als selbstverständliche Lehrwerkzeuge etablieren, wie es früher der Fall mit Druckbüchern war	Unterricht ist abwechslungsreicher	0	0	0
1	1.2.3	Internet und soziale Medien helfen den Unterricht lebendiger zu gestalten	Es liegt an den Lehrer:innen, die über Twitter geäußerten Inhalte auf nützlicher Art in den Unterricht zu integrieren	0	0	0
1	1.3.2	Ich auch bin schüchtern, und meistens sage ich deswegen nichts, aber wenn ich meine Meinung Twittern könnte, dann wurde is so tun, also glaube ich, dass das eine gute Methode ist und stimme mit ihm in dieser Aspekt zu.	Unterricht bleibt länger im Gedächtnis	0	0	0
1	1.3.1	Erstens können Personen, die zuvor aufgrund ihres Wissens nicht an der Diskussion teilnehmen konnten, dies tun, wenn sie kurze Textnachrichten senden.	Unterricht ist abwechslungsreicher	0	0	0
1	1.2.1	Gespräche sind gut	Autor befürwortet die Nutzung von Twitter im Unterricht	0	0	0
1	1.1.1	Lernen über Twitter	Sollen soziale Netzwerke wie Twitter als Werkzeug im Schulunterricht benutzt werden?	1	1	1
1	1.3.5	Ich auch bin schüchtern, und meistens sage ich deswegen nichts, aber wenn ich meine Meinung Twittern könnte, dann wurde is so tun, also glaube ich, dass das eine gute Methode ist und stimme mit ihm in dieser Aspekt zu.	Pädagogen raten zur Auseinandersetzung mit dem medialen Wandel	0	0	0
1	1.3.5	Schüchterne Schüler trauen sich vermehrt sich an Diskussionen zu beteiligen	Pädagogen raten zur Auseinandersetzung mit dem medialen Wandel	0	0	0
1	1.2.2	Der Autor drückt es nicht direkt aus.	Autor sieht in Twitter Chancen für innovative, konstruktive Unterrichtsmethoden	0	0	0
1	1.3.2	Auch deutsche Erziehungswissenschaftler sind inzwischen der Ansicht, dass Schüler und Lehrer sich dringend mit sozialen Medien auseinandersetzen müssen.	Unterricht bleibt länger im Gedächtnis	0	0	0
1	1.3.5	Auf diese Weise würden die Geschichtsereignisse stärker im Gedächtnis haften bleiben, sagt Rösch. Und die Schüler profitieren von einem interessanten und abwechslungsreichen Unterricht.	Pädagogen raten zur Auseinandersetzung mit dem medialen Wandel	0	0	0
1	1.1.1	Sind Soziale Medien im Unterricht eine Hilfe Wissen zu vermittlen?	Sollen soziale Netzwerke wie Twitter als Werkzeug im Schulunterricht benutzt werden?	2	2	2
1	1.3.1	Gelingt das, können damit auch sonst eher stille Schüler erreicht werden	Unterricht ist abwechslungsreicher	0	0	0
1	1.3.7	Besser und abwechslungsreicher Unterricht	Angst vor Ablenkung ist nicht begündet, da auch Bücher ablenken können	0	0	0
1	1.3.2	Durch Inszenierung bleiben Geschichtsereignisse stärker im Gedächtnis	Unterricht bleibt länger im Gedächtnis	3	2	2.5
1	1.3.5	Auch Schüler, die sich sonst nicht zu Wort melden, werden integriert	Pädagogen raten zur Auseinandersetzung mit dem medialen Wandel	0	0	0
1	1.2.2	Der Autor sagt, es sei normal, dass Leute Medien im Unterricht benutzen, andere Dinge lenken auch ab	Autor sieht in Twitter Chancen für innovative, konstruktive Unterrichtsmethoden	0	0	0
1	1.3.4	Social Media ist ein guter Trend, der zum Lernen genutzt werden kann, nach Angaben von Psychologen	Auch schüchterne Schüler:innen werden ermutigt, ihre Meinungen zu äußern	0	0	0
1	1.3.4	Rollenspiele um sich besser an das Unterrichtsthema erinnern zu können	Auch schüchterne Schüler:innen werden ermutigt, ihre Meinungen zu äußern	0	0	0
1	1.3.2	Der Unterricht wird abwechslungsreicher gestaltet	Unterricht bleibt länger im Gedächtnis	0	0	0
1	1.3.5	Gelingt das, können damit auch sonst eher stille Schüler erreicht werden, würden, sich auf diese Weise an der Diskussion beteiligten.	Pädagogen raten zur Auseinandersetzung mit dem medialen Wandel	0	0	0
1	1.2.2	Der Autor ist der Ansicht, dass die Einführung von Twitter ein aufkommender Trend in der Lehrer-Schüler-Interaktion ist, der viele gute Potenziale aufweist.	Autor sieht in Twitter Chancen für innovative, konstruktive Unterrichtsmethoden	2	2	2
1	1.3.6	Der Autor sieht Fernunterricht positiv, weil er die Schüler zum Lernen ermutigt und die Lehrer die Entwicklung des Internets verfolgen sollten	Es gibt Erfolgsbeispiele für die Nutzung von Twitter im Unterricht, z.B. in den USA	0	0	0
1	1.2.3	Das Internet wird in Zukunft das Hauptmedium für das Lernen sein	Es liegt an den Lehrer:innen, die über Twitter geäußerten Inhalte auf nützlicher Art in den Unterricht zu integrieren	0	0	0
1	1.3.2	Erstens können Personen, die zuvor aufgrund ihres Wissens nicht an der Diskussion teilnehmen konnten, dies tun, wenn sie kurze Textnachrichten senden.	Unterricht bleibt länger im Gedächtnis	0	0	0
1	1.3.5	Die ganze Klasse setzt fur das Lernen ein(sogar Leute, die nie etwas sagen)	Pädagogen raten zur Auseinandersetzung mit dem medialen Wandel	0	0	0
1	1.2.3	Er zitiert jedoch Daten und Forschungsergebnisse, die auf eine günstige Anwendung der beschriebenen Methode hinweisen.	Es liegt an den Lehrer:innen, die über Twitter geäußerten Inhalte auf nützlicher Art in den Unterricht zu integrieren	0	0	0
1	1.3.5	Ergebnisse bleiben besser im Gedächtnis	Pädagogen raten zur Auseinandersetzung mit dem medialen Wandel	0	0	0
1	1.3.4	Schüchterne Schüler miteinbeziehen	Auch schüchterne Schüler:innen werden ermutigt, ihre Meinungen zu äußern	2	2	2
1	1.3.6	Auch stille Schüler werden dazu animiert, beim Unterricht mitzumachen da sie sich durchs schreiben ausdrücken können	Es gibt Erfolgsbeispiele für die Nutzung von Twitter im Unterricht, z.B. in den USA	0	0	0
1	1.3.6	Ich auch bin schüchtern, und meistens sage ich deswegen nichts, aber wenn ich meine Meinung Twittern könnte, dann wurde is so tun, also glaube ich, dass das eine gute Methode ist und stimme mit ihm in dieser Aspekt zu.	Es gibt Erfolgsbeispiele für die Nutzung von Twitter im Unterricht, z.B. in den USA	0	0	0
1	1.3.1	Bringt stillere Schüler dazu sich mehr an den Diskussionen zu beteiligen	Unterricht ist abwechslungsreicher	0	0	0
1	1.3.1	Derzeit entwickeln sich soziale Medien rasant und werden von jungen Menschen und Lehrern immer häufiger genutzt.	Unterricht ist abwechslungsreicher	0	0	0
1	1.3.4	Soziale Netzwerke machen den Unterricht spannender und abwechslungsreicher, und Schüler behalten den Stoff deswegen besser bei	Auch schüchterne Schüler:innen werden ermutigt, ihre Meinungen zu äußern	0	0	0
1	1.3.1	Schüchterne Schüler trauen sich vermehrt sich an Diskussionen zu beteiligen	Unterricht ist abwechslungsreicher	0	0	0
1	1.4.1	Viele Lehrer sind skeptisch bei diesen Trend.	Schüler:innen können leicht abgelenkt werden	0	1	0.5
1	1.3.5	Es wird nicht ohne Bücher im Klassenzimmer auskommen, nur weil es eine Ablenkung sein kann.	Pädagogen raten zur Auseinandersetzung mit dem medialen Wandel	0	0	0
1	1.3.5	Es können auch eher stille Schüler erreicht werden, die sich sonst nicht an den Diskussionen beteiligen würden.	Pädagogen raten zur Auseinandersetzung mit dem medialen Wandel	0	0	0
1	1.2.3	Schüler und Pädagogen profitieren von alternativen Kommunikationsmitteln während den Unterricht	Es liegt an den Lehrer:innen, die über Twitter geäußerten Inhalte auf nützlicher Art in den Unterricht zu integrieren	0	0	0
1	1.4.1	Das nutzen von Sozialen Netzwerken würde die Schüler ablenken	Schüler:innen können leicht abgelenkt werden	2	3	2.5
1	1.3.5	es kann sein, dass die Schüler so gewonnenes Wissen besser behalten	Pädagogen raten zur Auseinandersetzung mit dem medialen Wandel	0	0	0
1	1.3.1	Soziale Netzwerke machen Kommunikation unkomplizierter	Unterricht ist abwechslungsreicher	0	0	0
1	1.3.7	Der Autor argumentiert, dass Situationen wie diese den Gesprächsverlauf fördern, den Schülern Raum geben, sich zu beteiligen und sich mehr auszudrücken, und die zurückhaltendsten und stillsten ermutigen.	Angst vor Ablenkung ist nicht begündet, da auch Bücher ablenken können	0	0	0
1	1.2.2	Soziale Netzwerke wie Twitter helfen dabei, Diskussionen anzustoßen	Autor sieht in Twitter Chancen für innovative, konstruktive Unterrichtsmethoden	2	1	1.5
1	1.2.2	Die Lehrer sollen mit Soziale Medien arbeiten.	Autor sieht in Twitter Chancen für innovative, konstruktive Unterrichtsmethoden	1	2	1.5
1	1.3.3	Erstens können Personen, die zuvor aufgrund ihres Wissens nicht an der Diskussion teilnehmen konnten, dies tun, wenn sie kurze Textnachrichten senden.	Nutzung von Twitter senkt die Hemmung vor aktiver Beteiligung am Unterricht	0	2	1
1	1.3.2	Schüler die normalerweise schweigen würden, beteiligen sich am Unterricht	Unterricht bleibt länger im Gedächtnis	0	0	0
1	1.3.1	Der Unterricht wird abwechslungsreicher gestaltet	Unterricht ist abwechslungsreicher	4	4	4
1	1.2.3	Soziale Medien, welche in den Unterricht eingebunden werden, helfen dabei Diskussionen zu fördern und nachhaltige Erinnerungen an den Unterricht und dessen Thema zu schaffen.	Es liegt an den Lehrer:innen, die über Twitter geäußerten Inhalte auf nützlicher Art in den Unterricht zu integrieren	1	0	0.5
1	1.3.1	Dies fördert die Konversation	Unterricht ist abwechslungsreicher	0	0	0
1	1.3.1	Die Medien müssen nicht die Ursache für die mangelnde Aufmerksamkeit der Schüler während des Unterrichts sein.	Unterricht ist abwechslungsreicher	0	0	0
1	1.3.5	Durch den Einsatz neuer Lehrplattformen steigt die Lernbereitschaft vieler Schüler, die mit den 'traditionellen' Lehrmitteln vielleicht nicht zufrieden waren	Pädagogen raten zur Auseinandersetzung mit dem medialen Wandel	1	0	0.5
1	1.3.6	Schüchterne Schüler trauen sich vermehrt sich an Diskussionen zu beteiligen	Es gibt Erfolgsbeispiele für die Nutzung von Twitter im Unterricht, z.B. in den USA	0	0	0
1	1.3.1	Der Unterricht wird dynamischer	Unterricht ist abwechslungsreicher	2	2	2
1	1.3.6	Social Media ist ein guter Trend, der zum Lernen genutzt werden kann, nach Angaben von Psychologen	Es gibt Erfolgsbeispiele für die Nutzung von Twitter im Unterricht, z.B. in den USA	0	0	0
1	1.3.7	Dieser Ansatz es schüchternen Schülern leichter fällt, an der Diskussion teilzunehmen	Angst vor Ablenkung ist nicht begündet, da auch Bücher ablenken können	0	0	0
1	1.3.4	Da auf Sozialen Medien die Hemmschwelle des kommentierens geringer ist, beteiligen sich mehr Schüler aktiv am Unterricht.	Auch schüchterne Schüler:innen werden ermutigt, ihre Meinungen zu äußern	1	1	1
1	1.2.2	es wäre positiv, Sozial Medien in Schulklasse mehr zu benutzen	Autor sieht in Twitter Chancen für innovative, konstruktive Unterrichtsmethoden	2	2	2
1	1.3.4	Er sagt, dass die Einführung von sozialen Medien vergleichbar ist mit der Erfindung des Buchdrucks.	Auch schüchterne Schüler:innen werden ermutigt, ihre Meinungen zu äußern	0	0	0
1	1.4.1	Verschiedene Formen der Ablenkung.	Schüler:innen können leicht abgelenkt werden	2	2	2
1	1.3.2	Es kann die Informationverarbeitung fördern	Unterricht bleibt länger im Gedächtnis	1	2	1.5
1	1.3.6	Soziale Netzwerke machen Kommunikation unkomplizierter	Es gibt Erfolgsbeispiele für die Nutzung von Twitter im Unterricht, z.B. in den USA	0	0	0
1	1.3.6	Der Unterricht ist angenehmer	Es gibt Erfolgsbeispiele für die Nutzung von Twitter im Unterricht, z.B. in den USA	0	0	0
1	1.3.7	die Schüler profitieren von einem interessanten und abwechslungsreichen Unterricht	Angst vor Ablenkung ist nicht begündet, da auch Bücher ablenken können	0	0	0
1	1.2.1	Er hält es für eine gute Idee, weil jeder soziale Medien nutzt	Autor befürwortet die Nutzung von Twitter im Unterricht	1	2	1.5
1	1.3.4	Schüchterne Schüler können auch Kommentare in sozialen Medien veröffentlichen.	Auch schüchterne Schüler:innen werden ermutigt, ihre Meinungen zu äußern	2	3	2.5
1	1.3.5	Auch zurückhaltende Schüler nehmen so am Unterricht teil	Pädagogen raten zur Auseinandersetzung mit dem medialen Wandel	0	0	0
1	1.3.4	Der Unterricht mit sozialen Medien kann für Schüler interessanter sein, sie erinnern sich mehr an solche Aktivitäten.	Auch schüchterne Schüler:innen werden ermutigt, ihre Meinungen zu äußern	0	0	0
1	1.3.2	Besser und abwechslungsreicher Unterricht	Unterricht bleibt länger im Gedächtnis	1	0	0.5
1	1.3.5	Soziale Medien ermöglichen schüchternen Schülern, am Unterricht teilzunehmen	Pädagogen raten zur Auseinandersetzung mit dem medialen Wandel	0	0	0
1	1.3.6	Derzeit entwickeln sich soziale Medien rasant und werden von jungen Menschen und Lehrern immer häufiger genutzt.	Es gibt Erfolgsbeispiele für die Nutzung von Twitter im Unterricht, z.B. in den USA	1	0	0.5
1	1.3.3	Die Diskussion schließt Menschen ein, die zu schüchtern sind, um vor einer großen Gruppe von Menschen zu sprechen.	Nutzung von Twitter senkt die Hemmung vor aktiver Beteiligung am Unterricht	2	1	1.5
1	1.3.5	Soziale Netzwerke machen Kommunikation unkomplizierter	Pädagogen raten zur Auseinandersetzung mit dem medialen Wandel	0	0	0
1	1.3.7	Größere Kreativität	Angst vor Ablenkung ist nicht begündet, da auch Bücher ablenken können	0	0	0
1	1.3.2	Kurze Antworten auf Twitter machen den Studenten Aussagen leichter	Unterricht bleibt länger im Gedächtnis	0	0	0
1	1.3.4	Das Nutzen von sozialen Media macht das Unterricht interessanter für Schüler	Auch schüchterne Schüler:innen werden ermutigt, ihre Meinungen zu äußern	0	0	0
1	1.3.6	Stille Schüler können so besser erreicht werden.	Es gibt Erfolgsbeispiele für die Nutzung von Twitter im Unterricht, z.B. in den USA	0	0	0
1	1.4.1	Lehrer müssen Umgang mit sozialen Netzwerken erst erlernen und für neue Zugänge offen sein	Schüler:innen können leicht abgelenkt werden	0	0	0
1	1.3.1	schüchterne Menschen beginnen, sich auf den Unterricht einzulassen	Unterricht ist abwechslungsreicher	0	0	0
1	1.3.1	Dies ermutigt ruhigere Schüler zur Teilnahme	Unterricht ist abwechslungsreicher	0	0	0
1	1.3.1	Die Gefahr, dass Schüler sich ablenken lassen besteht auch ohne technische Geräte	Unterricht ist abwechslungsreicher	0	0	0
1	1.2.2	positiv für Online-Lernen	Autor sieht in Twitter Chancen für innovative, konstruktive Unterrichtsmethoden	1	1	1
1	1.3.4	Der Autor argumentiert, dass Kinder sich besser konzentrieren können, wenn ihre Aufgabe z. B. auf Twitter gestellt wird.	Auch schüchterne Schüler:innen werden ermutigt, ihre Meinungen zu äußern	0	0	0
1	1.3.2	Gelingt das, können damit auch sonst eher stille Schüler erreicht werden	Unterricht bleibt länger im Gedächtnis	0	0	0
1	1.3.6	Die Medien müssen nicht die Ursache für die mangelnde Aufmerksamkeit der Schüler während des Unterrichts sein.	Es gibt Erfolgsbeispiele für die Nutzung von Twitter im Unterricht, z.B. in den USA	0	0	0
1	1.3.3	Der Unterricht mit Social Media ist abwechslungsreicher und interessanter	Nutzung von Twitter senkt die Hemmung vor aktiver Beteiligung am Unterricht	0	0	0
1	1.2.2	die positiven Chancen die dies bietet überwiegen	Autor sieht in Twitter Chancen für innovative, konstruktive Unterrichtsmethoden	1	2	1.5
1	1.3.7	Die Diskussion schließt Menschen ein, die zu schüchtern sind, um vor einer großen Gruppe von Menschen zu sprechen.	Angst vor Ablenkung ist nicht begündet, da auch Bücher ablenken können	0	0	0
1	1.2.3	Social Media ist ein großartiger und innovativer Unterrichtsansatz.	Es liegt an den Lehrer:innen, die über Twitter geäußerten Inhalte auf nützlicher Art in den Unterricht zu integrieren	0	0	0
1	1.3.2	Rollenspiele um sich besser an das Unterrichtsthema erinnern zu können	Unterricht bleibt länger im Gedächtnis	2	2	2
1	1.3.2	Twitter ist nützlich, um neue Diskussionsformen zu erstellen.	Unterricht bleibt länger im Gedächtnis	1	0	0.5
1	1.3.3	Besser und abwechslungsreicher Unterricht	Nutzung von Twitter senkt die Hemmung vor aktiver Beteiligung am Unterricht	1	0	0.5
1	1.3.4	Sonst schüchterne Schüler werden besser in die Diskussion miteingebunden	Auch schüchterne Schüler:innen werden ermutigt, ihre Meinungen zu äußern	2	2	2
1	1.3.7	Es kann die Informationverarbeitung fördern	Angst vor Ablenkung ist nicht begündet, da auch Bücher ablenken können	0	0	0
1	1.3.2	Aktivität von schüchternen Schülern	Unterricht bleibt länger im Gedächtnis	0	0	0
1	1.3.7	Der Unterricht ist angenehmer	Angst vor Ablenkung ist nicht begündet, da auch Bücher ablenken können	0	0	0
1	1.3.3	Auch deutsche Erziehungswissenschaftler sind inzwischen der Ansicht, dass Schüler und Lehrer sich dringend mit sozialen Medien auseinandersetzen müssen.	Nutzung von Twitter senkt die Hemmung vor aktiver Beteiligung am Unterricht	0	0	0
1	1.3.2	Auf diese Weise würden die Geschichtsereignisse stärker im Gedächtnis haften bleiben, sagt Rösch. Und die Schüler profitieren von einem interessanten und abwechslungsreichen Unterricht.	Unterricht bleibt länger im Gedächtnis	2	2	2
1	1.3.1	Besser und abwechslungsreicher Unterricht	Unterricht ist abwechslungsreicher	4	4	4
1	1.3.5	Social Media ist ein guter Trend, der zum Lernen genutzt werden kann, nach Angaben von Psychologen	Pädagogen raten zur Auseinandersetzung mit dem medialen Wandel	2	1	1.5
1	1.3.3	Das gelernte Material bleibt länger im Gedächtnis der Schüler, da es mehr auf ihre Sprache vermittelt wird	Nutzung von Twitter senkt die Hemmung vor aktiver Beteiligung am Unterricht	0	0	0
1	1.3.2	Soziale Netzwerke machen Kommunikation unkomplizierter	Unterricht bleibt länger im Gedächtnis	1	0	0.5
1	1.3.2	Fortschritt der Gesellschaft	Unterricht bleibt länger im Gedächtnis	0	0	0
1	1.3.1	Zurückhaltende Schüler nehmen mehr teil an den Unterricht.	Unterricht ist abwechslungsreicher	0	0	0
1	1.2.2	Es ist nur zeitgemäß neue Technologien in den Unterricht zu integrieren	Autor sieht in Twitter Chancen für innovative, konstruktive Unterrichtsmethoden	1	1	1
1	1.4.1	Angst vor Zerstreuung ist wichtig	Schüler:innen können leicht abgelenkt werden	2	2	2
1	1.3.2	Der Autor sieht Fernunterricht positiv, weil er die Schüler zum Lernen ermutigt und die Lehrer die Entwicklung des Internets verfolgen sollten	Unterricht bleibt länger im Gedächtnis	0	0	0
1	1.1.1	die Benutzung von Soziale Medien im Unterricht	Sollen soziale Netzwerke wie Twitter als Werkzeug im Schulunterricht benutzt werden?	2	2	2
1	1.3.3	Auf diese Weise würden die Geschichtsereignisse stärker im Gedächtnis haften bleiben, sagt Rösch. Und die Schüler profitieren von einem interessanten und abwechslungsreichen Unterricht.	Nutzung von Twitter senkt die Hemmung vor aktiver Beteiligung am Unterricht	0	0	0
1	1.3.7	Gelingt das, können damit auch sonst eher stille Schüler erreicht werden, würden, sich auf diese Weise an der Diskussion beteiligten.	Angst vor Ablenkung ist nicht begündet, da auch Bücher ablenken können	0	0	0
1	1.2.2	Ich denke Der Autor findet sich sehr interessant die Erfahrungen von Lehrer	Autor sieht in Twitter Chancen für innovative, konstruktive Unterrichtsmethoden	0	1	0.5
1	1.3.5	der positive Effekt von Twitter für die Gesprächkultur wurde von Psychologen bewiesen	Pädagogen raten zur Auseinandersetzung mit dem medialen Wandel	1	0	0.5
1	1.3.7	abwechslungsreicher und spannender Unterricht	Angst vor Ablenkung ist nicht begündet, da auch Bücher ablenken können	0	0	0
1	1.3.4	Der Unterricht wird für die Schüler interessanter und abwechslungsreicher	Auch schüchterne Schüler:innen werden ermutigt, ihre Meinungen zu äußern	0	0	0
1	1.3.6	Soziale Medien ermöglichen den Unterricht, winkungsvoller für die Klasse zu sein	Es gibt Erfolgsbeispiele für die Nutzung von Twitter im Unterricht, z.B. in den USA	1	0	0.5
1	1.3.1	Aktivität von schüchternen Schülern	Unterricht ist abwechslungsreicher	0	0	0
1	1.3.6	die Klasse wird motiviert mit zu arbeiten	Es gibt Erfolgsbeispiele für die Nutzung von Twitter im Unterricht, z.B. in den USA	0	0	0
1	1.2.1	Die Lehrer sollen mit Soziale Medien arbeiten.	Autor befürwortet die Nutzung von Twitter im Unterricht	2	2	2
1	1.1.1	Sollten die Lehrer Social Media als Werkzeug für die Arbeit mit Schülern einführen?	Sollen soziale Netzwerke wie Twitter als Werkzeug im Schulunterricht benutzt werden?	2	3	2.5
1	1.3.7	Spaßiger	Angst vor Ablenkung ist nicht begündet, da auch Bücher ablenken können	0	0	0
1	1.3.5	Soziale Medien sind näher am Lebensalltag der Schüler	Pädagogen raten zur Auseinandersetzung mit dem medialen Wandel	1	1	1
1	1.3.6	Zurückhaltendere Schüler beteiligen sich wieder aktiver am Unterricht	Es gibt Erfolgsbeispiele für die Nutzung von Twitter im Unterricht, z.B. in den USA	0	0	0
1	1.3.1	Einfacher Zugang zum Lernen	Unterricht ist abwechslungsreicher	1	0	0.5
1	1.2.3	Das Nutzen von Internet macht das Unterricht für Schuler interaktiver	Es liegt an den Lehrer:innen, die über Twitter geäußerten Inhalte auf nützlicher Art in den Unterricht zu integrieren	0	0	0
1	1.2.3	Schüler können sich leicht ablenken lassen	Es liegt an den Lehrer:innen, die über Twitter geäußerten Inhalte auf nützlicher Art in den Unterricht zu integrieren	0	0	0
1	1.3.3	Die ganze Klasse setzt fur das Lernen ein(sogar Leute, die nie etwas sagen)	Nutzung von Twitter senkt die Hemmung vor aktiver Beteiligung am Unterricht	1	2	1.5
1	1.3.4	Schüchterne Schüler, die normalerweise schweigen würden, würden an einer Twitter-Diskussion teilnehmen	Auch schüchterne Schüler:innen werden ermutigt, ihre Meinungen zu äußern	3	3	3
1	1.3.2	abwechslungsreicher und spannender Unterricht	Unterricht bleibt länger im Gedächtnis	0	0	0
1	1.2.2	Die Integration von Social Media in den Lernprozess im Unterricht ist erwünscht	Autor sieht in Twitter Chancen für innovative, konstruktive Unterrichtsmethoden	2	2	2
1	1.3.5	Auch sei ein Verschließen gegenüber neuer Technik nicht Ziel eines modernen Schulsystems.	Pädagogen raten zur Auseinandersetzung mit dem medialen Wandel	2	2	2
1	1.2.1	Der Autor sagt, es sei normal, dass Leute Medien im Unterricht benutzen, andere Dinge lenken auch ab	Autor befürwortet die Nutzung von Twitter im Unterricht	1	0	0.5
1	1.3.4	Soziale Medien sind näher am Lebensalltag der Schüler	Auch schüchterne Schüler:innen werden ermutigt, ihre Meinungen zu äußern	0	0	0
1	1.2.2	Die Ablenkung kann auch ohne Internet stattfinden	Autor sieht in Twitter Chancen für innovative, konstruktive Unterrichtsmethoden	0	0	0
1	1.3.2	Schüchterne Schüler trauen sich vermehrt sich an Diskussionen zu beteiligen	Unterricht bleibt länger im Gedächtnis	0	0	0
1	1.1.1	Social Media in der Wissenschaft	Sollen soziale Netzwerke wie Twitter als Werkzeug im Schulunterricht benutzt werden?	0	1	0.5
1	1.3.6	Der Unterricht ist interessanter	Es gibt Erfolgsbeispiele für die Nutzung von Twitter im Unterricht, z.B. in den USA	0	0	0
1	1.3.2	Die Schüler die normalerweise schweigen würden, sich auf diese Weise an der Diskussion beteiligten	Unterricht bleibt länger im Gedächtnis	0	0	0
1	1.3.5	Schüler profitieren von einem interessanten und abwechslungreichen Unterricht	Pädagogen raten zur Auseinandersetzung mit dem medialen Wandel	1	0	0.5
1	1.3.6	Jeder kann kommentieren, seine persönliche Meinung artikulieren.	Es gibt Erfolgsbeispiele für die Nutzung von Twitter im Unterricht, z.B. in den USA	0	0	0
1	1.2.3	Der Autor ist der Ansicht, dass die Einführung von Twitter ein aufkommender Trend in der Lehrer-Schüler-Interaktion ist, der viele gute Potenziale aufweist.	Es liegt an den Lehrer:innen, die über Twitter geäußerten Inhalte auf nützlicher Art in den Unterricht zu integrieren	0	0	0
1	1.2.3	Können Lehrer dabei unterstützen Unterrichtsinhalte besser zu vermitteln	Es liegt an den Lehrer:innen, die über Twitter geäußerten Inhalte auf nützlicher Art in den Unterricht zu integrieren	1	0	0.5
1	1.3.4	Der Unterricht wird abwechslungsreicher gestaltet	Auch schüchterne Schüler:innen werden ermutigt, ihre Meinungen zu äußern	0	0	0
1	1.3.4	schüchterne Menschen beginnen, sich auf den Unterricht einzulassen	Auch schüchterne Schüler:innen werden ermutigt, ihre Meinungen zu äußern	3	2	2.5
1	1.3.3	Soziale Netzwerke im Unterricht erlauben neue Diskussionsformen.	Nutzung von Twitter senkt die Hemmung vor aktiver Beteiligung am Unterricht	1	0	0.5
1	1.3.7	Die Schüler berichten von positiven Erfahrungen	Angst vor Ablenkung ist nicht begündet, da auch Bücher ablenken können	0	0	0
1	1.3.5	Bringt stillere Schüler dazu sich mehr an den Diskussionen zu beteiligen	Pädagogen raten zur Auseinandersetzung mit dem medialen Wandel	0	0	0
1	1.3.7	Es können auch eher stille Schüler erreicht werden, die sich sonst nicht an den Diskussionen beteiligen würden.	Angst vor Ablenkung ist nicht begündet, da auch Bücher ablenken können	0	0	0
1	1.3.2	Auch stille Schüler werden dazu animiert, beim Unterricht mitzumachen da sie sich durchs schreiben ausdrücken können	Unterricht bleibt länger im Gedächtnis	0	0	0
