topic_id	ref_id	s1	s2	anno_1	anno_2	anno_average
2	2.3.3	Der Jugend brauchen morgens länger Schlaf. Konzentration verbessert, Leistungen verbesserten sich und die Fehlzeiten waren geringer Stunde auf 8.45 Uhr nach hinten	US-Studie zeigt Vorteile des späteren Schulanfangs	1	1	1
2	2.3.3	Schlafmangel hat Auswirkungen auf die Konzentrations- und Leistungsfähigkeit der Jugendlichen	US-Studie zeigt Vorteile des späteren Schulanfangs	0	0	0
2	2.3.2	In USA schlafen Kinder länger, bessere Leistung, weniger Fehlzeiten	Schlafmangel hat einen negativen Einfluss auf die Konzentration und Schulleistung	0	0	0
2	2.4.5	eine Mittagsversorgung müsste eingerichtet werden, danach gäbe es noch weiteren Unterricht-wenig Akzeptanz dieser Idee	Tageslicht hat einen größeren Einfluss auf die Leistungsfähigkeit als die Uhrzeit des Schulbeginns	0	0	0
2	2.4.3	Das Schulbussystem zu reorganisieren, wenn die Schüler alle zu unterschiedlichen Zeiten beginnen.	Schüler:innen hätten weniger Freizeit am Nachmittag zur Verfügung	0	0	0
2	2.4.1	Ein späterer Schulbeginn bedeutet, dass Nachmittags auch noch gearbeitet wird	Umstellung der Schulbusse auf dem Land wäre problematisch	0	0	0
2	2.3.3	längerer Schlaf, bessere Leistung, weniger Fehlzeiten	US-Studie zeigt Vorteile des späteren Schulanfangs	0	0	0
2	2.3.2	Aufstehen mit dem Tageslicht ist entscheidend für die Leistungsfähigkeit.	Schlafmangel hat einen negativen Einfluss auf die Konzentration und Schulleistung	0	0	0
2	2.4.1	Wenn die Schule später beginnt, müssten die Schüler später rausgehen, was eine kürzere Nachmittagszeit bedeutet.	Umstellung der Schulbusse auf dem Land wäre problematisch	0	0	0
2	2.4.4	Freier Nachmittag ist wichtiger als späteres Aufstehen.	Schulen müssten bei späteren Schulzeiten Mittagsversorgung anbieten	0	0	0
2	2.4.1	Schulbusse auf dem Land	Umstellung der Schulbusse auf dem Land wäre problematisch	2	3	2.5
2	2.4.3	Besonders auf dem Land können Schüler, die zu unterschiedlichen Zeiten beginnen, ein Problem für die Schulbusse darstellen	Schüler:innen hätten weniger Freizeit am Nachmittag zur Verfügung	0	0	0
2	2.3.3	Eine Studie aus Seattle zeigte dass bei einem späteren Schulstart Schüler länger schlafen konnten und Fehlzeiten reduziert worden	US-Studie zeigt Vorteile des späteren Schulanfangs	2	2	2
2	2.1.1	Das Thema des Artikels ist die biologische Uhr und frühes Aufstehen für die Schule	Soll die Schule morgens später anfangen?	1	2	1.5
2	2.4.5	Die Schulen müssen das Mittagessen organisieren - der Unterricht wird zur Mittagszeit fortgesetzt	Tageslicht hat einen größeren Einfluss auf die Leistungsfähigkeit als die Uhrzeit des Schulbeginns	0	0	0
2	2.3.2	Wenig schlaf schraenkt die Leistungsfaehigkeit	Schlafmangel hat einen negativen Einfluss auf die Konzentration und Schulleistung	3	3	3
2	2.3.3	Wenn es für eine perrmanente Sommerzeit entschieden wird, dann müssten Schüler später die Schule beginnen, denn das Tageslicht ist wicthig für die Leistungsfähigkeit.	US-Studie zeigt Vorteile des späteren Schulanfangs	0	0	0
2	2.3.2	es wurde dokumentiert, dass die Schüler nach dem späteren aufstehen konzentrierter sind und das sich ihre Leistungsfähigkeit verbessert	Schlafmangel hat einen negativen Einfluss auf die Konzentration und Schulleistung	2	3	2.5
2	2.3.1	Schlafmangel schränkt die Leistungsfähigkeit ein, führt zu Konzentrations- und Ausdauerstörungen und macht schlechte Laune.	In der Pubertät werden viele Jugendliche zu Spättypen und brauchen morgens länger Schlaf	0	0	0
2	2.4.5	Es gibt die Probleme mit dem Zugang - insbesondere von kleinen Städten.	Tageslicht hat einen größeren Einfluss auf die Leistungsfähigkeit als die Uhrzeit des Schulbeginns	0	0	0
2	2.4.5	1 bis 6 Klässler haben sich in einer Studie gegen den späteren freien Nachmittag ausgesprochen	Tageslicht hat einen größeren Einfluss auf die Leistungsfähigkeit als die Uhrzeit des Schulbeginns	0	0	0
2	2.3.4	Frühtypen wird das frühe Aufstehen eher keine Probleme machen	Bei späterem Schulbeginn können Fehlzeiten weniger werden	0	0	0
2	2.3.2	bekommt erst große Zustimmung	Schlafmangel hat einen negativen Einfluss auf die Konzentration und Schulleistung	0	0	0
2	2.3.3	das Tageslicht spielt eine entscheidende Rolle für die Leistungsfähigkeit. Nicht die Uhrzeit beeinflusse die innere Uhr, sondern die Zeit, die man dem Sonnenlicht ausgesetzt sei	US-Studie zeigt Vorteile des späteren Schulanfangs	0	0	0
2	2.4.1	Schüler stehen lieber früh auf, als Nachmittags Schule zu haben	Umstellung der Schulbusse auf dem Land wäre problematisch	0	0	0
2	2.3.4	Gesundheit wird gefördert durch mehr Schlaf.	Bei späterem Schulbeginn können Fehlzeiten weniger werden	0	0	0
2	2.3.3	Leistungen verbessern sich	US-Studie zeigt Vorteile des späteren Schulanfangs	0	0	0
2	2.3.1	bessere Konzentration	In der Pubertät werden viele Jugendliche zu Spättypen und brauchen morgens länger Schlaf	0	0	0
2	2.4.2	Wenn die Schule später startet, würde die Schulzeit weiter in die Nachmittagszeit reichen, wodurch die Freizeit der Jugendlichen reduziert werden würde	Mit späterem Schulanfang hört die Schule auch später auf	1	2	1.5
2	2.4.4	der Schultag würde länger gehen und den Schulkindern ist ein freier Nachmittag wichtiger	Schulen müssten bei späteren Schulzeiten Mittagsversorgung anbieten	0	0	0
2	2.3.2	In Forschungsstudien haben Sie gefunden dass Studierende, die länger schlafen, haben bessere Ergebnisse und weniger Fehlzeiten.	Schlafmangel hat einen negativen Einfluss auf die Konzentration und Schulleistung	1	0	0.5
2	2.4.4	kein Tageslicht im Winter, keine Konzentration	Schulen müssten bei späteren Schulzeiten Mittagsversorgung anbieten	0	0	0
2	2.3.2	In der Pubertät neigen Jugendliche dazu "Spättypen" zu werden.	Schlafmangel hat einen negativen Einfluss auf die Konzentration und Schulleistung	0	0	0
2	2.4.4	Für Schulbusse wären unterschiedliche Zeiten problematisch	Schulen müssten bei späteren Schulzeiten Mittagsversorgung anbieten	0	0	0
2	2.4.3	Die Schule endet später.	Schüler:innen hätten weniger Freizeit am Nachmittag zur Verfügung	1	0	0.5
2	2.4.1	Der freie Nachmittag ist für die Studenten noch wichtiger, als das späte Aufstehen.	Umstellung der Schulbusse auf dem Land wäre problematisch	0	0	0
2	2.3.3	weniger abwesend	US-Studie zeigt Vorteile des späteren Schulanfangs	0	0	0
2	2.3.2	Verbesserte Leistungen	Schlafmangel hat einen negativen Einfluss auf die Konzentration und Schulleistung	1	2	1.5
2	2.4.3	Frühtypen wird es nicht (oder negativ) beeinflussen.	Schüler:innen hätten weniger Freizeit am Nachmittag zur Verfügung	0	0	0
2	2.4.4	Der Schultag würde sich bis in die Mittagszeit erstrecken, so dass jede Schule eine eigene Kantine bereitstellen müsste.	Schulen müssten bei späteren Schulzeiten Mittagsversorgung anbieten	4	3	3.5
2	2.4.3	Das Angebot an Mittagsversorgung und die Mittagspause.	Schüler:innen hätten weniger Freizeit am Nachmittag zur Verfügung	0	0	0
2	2.3.1	Ein längerer Schlaf wirkt sich laut Forschung nicht nur positiv auf die Konzentration aus, sondern auch auf die schulische Leistung und die Reduzierung von Fehlzeiten	In der Pubertät werden viele Jugendliche zu Spättypen und brauchen morgens länger Schlaf	0	0	0
2	2.3.4	Konzentration verbessert sich nachweislich (siehe Beispiel Seattle) durch mehr Schlaf in Verbindung mit dem späteren Schulstart	Bei späterem Schulbeginn können Fehlzeiten weniger werden	0	0	0
2	2.4.4	Probleme mit den Schulbussen	Schulen müssten bei späteren Schulzeiten Mittagsversorgung anbieten	0	0	0
2	2.4.1	Ein späterer Schulanfang würde ein Problem für die Schulbusse sein.	Umstellung der Schulbusse auf dem Land wäre problematisch	2	2	2
2	2.4.5	Die Schüler wollen zwar spät anfangen, aber auch früh aufhöhren und beides geht nicht.	Tageslicht hat einen größeren Einfluss auf die Leistungsfähigkeit als die Uhrzeit des Schulbeginns	0	0	0
2	2.4.1	Im Winter, wenn es früher dunkel wird, müssten die Schüler länger ohne Sonne und helles Licht bleiben.	Umstellung der Schulbusse auf dem Land wäre problematisch	0	0	0
2	2.4.5	die Schule würde Langer dauert	Tageslicht hat einen größeren Einfluss auf die Leistungsfähigkeit als die Uhrzeit des Schulbeginns	0	0	0
2	2.3.4	innere Uhr verändert sich	Bei späterem Schulbeginn können Fehlzeiten weniger werden	0	0	0
2	2.4.4	Schüler stehen lieber früh auf, als Nachmittags Schule zu haben	Schulen müssten bei späteren Schulzeiten Mittagsversorgung anbieten	0	0	0
2	2.1.1	Wäre es besser, wenn die Schule später beginnen würde?	Soll die Schule morgens später anfangen?	4	4	4
2	2.3.1	Je nach Stadt/Bundesland müssen Schüler noch früher für die Fahrt zur Schule aufstehen.	In der Pubertät werden viele Jugendliche zu Spättypen und brauchen morgens länger Schlaf	0	0	0
2	2.4.5	Schulbusse die für Schulen mit unterschiedlichem Schulbeginn eingesetzt werden, lassen sich schlecht planen	Tageslicht hat einen größeren Einfluss auf die Leistungsfähigkeit als die Uhrzeit des Schulbeginns	0	0	0
2	2.3.2	Die Schüler hatten bessere Ergebnisse in der Schule	Schlafmangel hat einen negativen Einfluss auf die Konzentration und Schulleistung	1	2	1.5
2	2.3.4	Längerer Schlaf verbessert die Konzentration der Schüler	Bei späterem Schulbeginn können Fehlzeiten weniger werden	0	0	0
2	2.1.1	Sollte die Schule schon um 8 Uhr beginnen?	Soll die Schule morgens später anfangen?	3	4	3.5
2	2.4.2	Das Schulprogramm müsste dann die Mittagspause beinhalten und die Scule müsste das Mittagsessen für alle Schüler versorgen.	Mit späterem Schulanfang hört die Schule auch später auf	0	0	0
2	2.3.2	Nach einer Studie in Seattle(USA) schliefen Schüler durchschnittlich 34 Minuten länger, ihre Leistungen verbesserten sich und die Fehlzeiten waren geringer.	Schlafmangel hat einen negativen Einfluss auf die Konzentration und Schulleistung	0	0	0
2	2.4.2	Längere Unterrichtsstunden beeinträchtigen die Mittagspause.	Mit späterem Schulanfang hört die Schule auch später auf	1	0	0.5
2	2.3.3	Mehr Schlaf würde die Leistungsfähigkeit erhöhen	US-Studie zeigt Vorteile des späteren Schulanfangs	1	0	0.5
2	2.3.1	Für viele Jugendliche ist das frühe Aufstehen zur Schulzeit eine Qual.	In der Pubertät werden viele Jugendliche zu Spättypen und brauchen morgens länger Schlaf	2	2	2
2	2.3.4	Schlafmangel schränkt Leistungsfähigkeit ein, Konzentrations- & Ausdauerstörungen, schlechte Laune	Bei späterem Schulbeginn können Fehlzeiten weniger werden	0	0	0
2	2.3.1	Mit den Entwicklung, verschiebt sich der biologische Zyklus in Richtung späteres Schlafengehen, sodass die Schüler können wieder wettmachen, indem sie später am Morgen aufstehen.	In der Pubertät werden viele Jugendliche zu Spättypen und brauchen morgens länger Schlaf	2	2	2
2	2.3.3	Schlafmangel schränkt die Leistungsfähigkeit ein, führt zu Konzentrations- und Ausdauerstörungen und macht schlechte Laune.	US-Studie zeigt Vorteile des späteren Schulanfangs	0	0	0
2	2.4.5	zurück in die Dunkelheit	Tageslicht hat einen größeren Einfluss auf die Leistungsfähigkeit als die Uhrzeit des Schulbeginns	0	1	0.5
2	2.3.3	Kinder müssen im Sommer bei Dunkelheit zur Schule gehen	US-Studie zeigt Vorteile des späteren Schulanfangs	0	0	0
2	2.3.3	Die Fehlzeiten sind geringer.	US-Studie zeigt Vorteile des späteren Schulanfangs	0	0	0
2	2.4.2	Leistungsfähigkeit & innere Uhr sind nicht von Uhrzeit abhängig, sondern von der Zeit, die man dem Sonnenlicht ausgesetzt ist --> keine permanente Sommerzeit, da SuS sonst viel länger bei Dunkelheit in die Schule gehen müssten	Mit späterem Schulanfang hört die Schule auch später auf	0	0	0
2	2.4.1	Die Schulbusse sind nicht fur alle da	Umstellung der Schulbusse auf dem Land wäre problematisch	2	2	2
2	2.4.4	zurück in die Dunkelheit	Schulen müssten bei späteren Schulzeiten Mittagsversorgung anbieten	0	0	0
2	2.4.1	Ein späterer Schulbeginn würde womöglich eine Mittagsbetreuung notwendig machen	Umstellung der Schulbusse auf dem Land wäre problematisch	0	0	0
2	2.4.5	Schulbusse auf dem Land	Tageslicht hat einen größeren Einfluss auf die Leistungsfähigkeit als die Uhrzeit des Schulbeginns	0	0	0
2	2.4.3	Es gibt ein Problem, wann soll die Mittagspause stattfinden. Es ist auch problematisch, für Kinder, die mit dem Bus zur Schule fahren. Es ist auch schwer für Kinder, sich anyupassen, wenn man die Uhren eine Stunde zurückstellt.	Schüler:innen hätten weniger Freizeit am Nachmittag zur Verfügung	0	0	0
2	2.4.4	Wenn die Schüler nachmittags draussen sich austoben können sie besser schlafen.	Schulen müssten bei späteren Schulzeiten Mittagsversorgung anbieten	0	0	0
2	2.3.1	Die Schüler haben deswegen bessere Noten, und kommen wehniger zu spät.	In der Pubertät werden viele Jugendliche zu Spättypen und brauchen morgens länger Schlaf	0	0	0
2	2.3.2	Die Schüler schlafen länger.	Schlafmangel hat einen negativen Einfluss auf die Konzentration und Schulleistung	1	0	0.5
2	2.4.1	Die Schüler sollten den Nachmittag über aktiv bleiben, damit sie früh schlafen können	Umstellung der Schulbusse auf dem Land wäre problematisch	0	0	0
2	2.4.2	Die Schule würde bis 14 Uhr dauern.	Mit späterem Schulanfang hört die Schule auch später auf	2	2	2
2	2.3.1	das Tageslicht spielt eine entscheidende Rolle für die Leistungsfähigkeit. Nicht die Uhrzeit beeinflusse die innere Uhr, sondern die Zeit, die man dem Sonnenlicht ausgesetzt sei	In der Pubertät werden viele Jugendliche zu Spättypen und brauchen morgens länger Schlaf	0	0	0
2	2.3.1	Schüler in der Pubertät sind tendenziell eher Spättypen, denen der frühe Schulanfang schwer fällt	In der Pubertät werden viele Jugendliche zu Spättypen und brauchen morgens länger Schlaf	3	2	2.5
2	2.3.2	Die allgemeine Meinung fast aller Studenten ist, dass es besser wäre, später anzufangen, allerdings nur, wenn man nicht später fertig wird.	Schlafmangel hat einen negativen Einfluss auf die Konzentration und Schulleistung	0	0	0
2	2.3.2	Zum einen fangen Kinder gerne etwas später an, sie können dann länger schlafen.	Schlafmangel hat einen negativen Einfluss auf die Konzentration und Schulleistung	1	0	0.5
2	2.4.2	Eine Mittagsverpflegung wird gegebenenfalls notwendig	Mit späterem Schulanfang hört die Schule auch später auf	0	0	0
2	2.4.5	Die Schule endet später.	Tageslicht hat einen größeren Einfluss auf die Leistungsfähigkeit als die Uhrzeit des Schulbeginns	0	0	0
2	2.3.1	Schüler brauchen mehr Schlaf, besonders Teenager, und ihre biologische Uhr stellt sich auf einen späteren Zeitplan ein, was bedeutet, dass sie abends länger aufbleiben als früher.	In der Pubertät werden viele Jugendliche zu Spättypen und brauchen morgens länger Schlaf	3	2	2.5
2	2.3.1	Demnach braucht man morgens mehr Schlaf	In der Pubertät werden viele Jugendliche zu Spättypen und brauchen morgens länger Schlaf	3	2	2.5
2	2.4.1	Busse, die die Schüler zur Schule bringen, müssten zu unterschiedlichen Zeiten fahren, was problematisch ist	Umstellung der Schulbusse auf dem Land wäre problematisch	2	2	2
2	2.3.2	In Seattle wurde die Unterricht auf Später verschoben und die Schüler schliefen durchschnittlich 34 Minuten länger, ihre Leistungen verbesserten sich und die Fehlzeiten waren geringer.	Schlafmangel hat einen negativen Einfluss auf die Konzentration und Schulleistung	0	1	0.5
2	2.3.4	Schlafmangel schränkt die Leistungsfähigkeit ein, führt zu Konzentrations- und Ausdauerstörungen und macht schlechte Laune	Bei späterem Schulbeginn können Fehlzeiten weniger werden	0	0	0
2	2.4.2	Studenten und Professoren müssten den Unterricht nach der Mittagspause fortsetzen	Mit späterem Schulanfang hört die Schule auch später auf	1	1	1
2	2.4.3	Die Mittagszeit würde sich verschieben, was bedeutet, dass die Schulen ein Mittagessen anbieten müssten.	Schüler:innen hätten weniger Freizeit am Nachmittag zur Verfügung	0	0	0
2	2.3.3	bessere Konzentration	US-Studie zeigt Vorteile des späteren Schulanfangs	0	0	0
2	2.4.5	Besonders auf dem Land können Schüler, die zu unterschiedlichen Zeiten beginnen, ein Problem für die Schulbusse darstellen	Tageslicht hat einen größeren Einfluss auf die Leistungsfähigkeit als die Uhrzeit des Schulbeginns	0	0	0
2	2.3.1	Der Jugend brauchen morgens länger Schlaf. Konzentration verbessert, Leistungen verbesserten sich und die Fehlzeiten waren geringer Stunde auf 8.45 Uhr nach hinten	In der Pubertät werden viele Jugendliche zu Spättypen und brauchen morgens länger Schlaf	2	2	2
2	2.4.2	Schueler koennten nicht mit dem Bus zur Schule	Mit späterem Schulanfang hört die Schule auch später auf	0	0	0
2	2.4.2	Der Unterschied zwischen der Zeit macht die Jugend kann Verzögerungen für das Mittagessen haben	Mit späterem Schulanfang hört die Schule auch später auf	0	0	0
2	2.3.2	wenn Schüler ausreichend schlafen, fehlen sie weniger und konzentrieren sich besser, die Leistungen verbessern sich	Schlafmangel hat einen negativen Einfluss auf die Konzentration und Schulleistung	2	3	2.5
2	2.1.1	Ist es sinnvoll den Unterricht erst um 8 Uhr oder noch später zu beginnen?	Soll die Schule morgens später anfangen?	3	4	3.5
2	2.4.4	Die Schüler sollten nach der Mittagspause noch mal Unterricht machen.	Schulen müssten bei späteren Schulzeiten Mittagsversorgung anbieten	1	0	0.5
2	2.3.4	Ausgeschlafene Schüler können sich besser konzentrieren.	Bei späterem Schulbeginn können Fehlzeiten weniger werden	0	0	0
2	2.4.4	Fahrplanprobleme mit Schulbus	Schulen müssten bei späteren Schulzeiten Mittagsversorgung anbieten	0	0	0
2	2.3.3	später erzielen die Schüler bessere Ergebnisse	US-Studie zeigt Vorteile des späteren Schulanfangs	1	0	0.5
2	2.4.2	Verschiedene Schulstartuhrzeiten würde zu Problemen mit den Schulbussen führen	Mit späterem Schulanfang hört die Schule auch später auf	0	0	0
2	2.4.2	Dunkelheit in die Schule gehen	Mit späterem Schulanfang hört die Schule auch später auf	0	0	0
2	2.3.3	Tageslicht hilft den Schülern, produktiv zu sein	US-Studie zeigt Vorteile des späteren Schulanfangs	0	0	0
2	2.4.4	Tageslicht spielt eine entscheidende Rolle für die Leistung. Menschen müssen Sonnenlicht ausgesetzt werden.	Schulen müssten bei späteren Schulzeiten Mittagsversorgung anbieten	0	0	0
2	2.4.3	Problematik der Schulbüsse	Schüler:innen hätten weniger Freizeit am Nachmittag zur Verfügung	0	0	0
2	2.3.3	Die Schüler schlafen an freien Wochenenden länger.	US-Studie zeigt Vorteile des späteren Schulanfangs	0	0	0
2	2.3.3	bekommt erst große Zustimmung	US-Studie zeigt Vorteile des späteren Schulanfangs	0	0	0
2	2.3.3	wenn Schüler ausreichend schlafen, fehlen sie weniger und konzentrieren sich besser, die Leistungen verbessern sich	US-Studie zeigt Vorteile des späteren Schulanfangs	1	0	0.5
2	2.3.1	Bei vielen Menschen verändert sich in der Pubertät die innere Uhr.	In der Pubertät werden viele Jugendliche zu Spättypen und brauchen morgens länger Schlaf	1	2	1.5
2	2.4.5	Probleme mit den Schulbussen	Tageslicht hat einen größeren Einfluss auf die Leistungsfähigkeit als die Uhrzeit des Schulbeginns	0	0	0
2	2.4.4	Frühtypen macht das frühe Aufstehen kein Problem	Schulen müssten bei späteren Schulzeiten Mittagsversorgung anbieten	0	0	0
2	2.3.3	Die Schüler schlafen länger.	US-Studie zeigt Vorteile des späteren Schulanfangs	1	0	0.5
2	2.4.3	Schule würde später Enden	Schüler:innen hätten weniger Freizeit am Nachmittag zur Verfügung	1	0	0.5
2	2.3.3	Mehr Schlaf für die Schüler	US-Studie zeigt Vorteile des späteren Schulanfangs	0	0	0
2	2.4.2	Andererseits verlassen sie die Schule nicht gerne später.	Mit späterem Schulanfang hört die Schule auch später auf	2	2	2
2	2.3.1	eine Studie zeigt, dass eine Verschiebung zu geringeren Fehlzeiten führt	In der Pubertät werden viele Jugendliche zu Spättypen und brauchen morgens länger Schlaf	0	0	0
2	2.3.2	Spättypen: Schlafmangel wenn Beginn um 8 Uhr	Schlafmangel hat einen negativen Einfluss auf die Konzentration und Schulleistung	1	0	0.5
2	2.4.1	Umstellung für Schulbusse vor allem auf dem Land	Umstellung der Schulbusse auf dem Land wäre problematisch	3	4	3.5
2	2.4.1	Schulunterricht wuerde Nachmittags sein	Umstellung der Schulbusse auf dem Land wäre problematisch	0	0	0
2	2.4.4	Die Schulbuse wären schwieriger zu organisieren	Schulen müssten bei späteren Schulzeiten Mittagsversorgung anbieten	0	0	0
2	2.1.1	Die Frage ist, ob es sinnvoll ist, um 20 Uhr in die Schule zu gehen.	Soll die Schule morgens später anfangen?	0	3	1.5
2	2.4.3	Studenten und Professoren müssten den Unterricht nach der Mittagspause fortsetzen	Schüler:innen hätten weniger Freizeit am Nachmittag zur Verfügung	2	0	1
2	2.4.4	Schulbusse müssten die Schüler zu Klassen bringen, die zu unterschiedlichen Zeiten beginnen	Schulen müssten bei späteren Schulzeiten Mittagsversorgung anbieten	0	0	0
2	2.4.4	Die Schule dauert langer. Der freie Nachmittag ist aber noch wichtiger, als das späte Aufstehen fur Die Jugendlichen	Schulen müssten bei späteren Schulzeiten Mittagsversorgung anbieten	0	0	0
2	2.4.3	Probleme mit den Schulbussen	Schüler:innen hätten weniger Freizeit am Nachmittag zur Verfügung	0	0	0
2	2.4.4	die Schüle würde später aufhören	Schulen müssten bei späteren Schulzeiten Mittagsversorgung anbieten	0	0	0
2	2.4.2	Die Schüler wollen lieber früh schluss haben als spät anfangen.	Mit späterem Schulanfang hört die Schule auch später auf	2	1	1.5
2	2.3.4	Für viele Jugendliche ist das frühe Aufstehen zur Schulzeit eine Qual.	Bei späterem Schulbeginn können Fehlzeiten weniger werden	0	0	0
2	2.4.4	Mittagsversorgung müsste angeboten werden	Schulen müssten bei späteren Schulzeiten Mittagsversorgung anbieten	3	3	3
2	2.3.1	Tageslicht macht wacher und fördert die Leistungsfähigkeit	In der Pubertät werden viele Jugendliche zu Spättypen und brauchen morgens länger Schlaf	0	0	0
2	2.4.1	Fahrplanprobleme mit Schulbus	Umstellung der Schulbusse auf dem Land wäre problematisch	3	3	3
2	2.4.2	Die Schule dauert langer. Der freie Nachmittag ist aber noch wichtiger, als das späte Aufstehen fur Die Jugendlichen	Mit späterem Schulanfang hört die Schule auch später auf	2	2	2
2	2.3.2	Schlafmangel schränkt die Leistungsfähigkeit ein, führt zu Konzentrations- und Ausdauerstörungen und macht schlechte Laune.	Schlafmangel hat einen negativen Einfluss auf die Konzentration und Schulleistung	3	3	3
2	2.3.3	Pubertät lässt viele zu Spätaufstehertyp werden	US-Studie zeigt Vorteile des späteren Schulanfangs	0	0	0
2	2.3.2	Studie zeigt: Leistungen verbesserten sich und die Fehlzeiten waren geringer	Schlafmangel hat einen negativen Einfluss auf die Konzentration und Schulleistung	1	1	1
2	2.4.5	Frühes Aufstehen verursacht keine Probleme für frühe Typen	Tageslicht hat einen größeren Einfluss auf die Leistungsfähigkeit als die Uhrzeit des Schulbeginns	0	0	0
2	2.3.4	bessere Konzentration	Bei späterem Schulbeginn können Fehlzeiten weniger werden	0	0	0
2	2.4.5	Die Schüler müssen bis später am Tag bleiben und zwischen den Unterrichtsstunden ein Mittagessen erhalten	Tageslicht hat einen größeren Einfluss auf die Leistungsfähigkeit als die Uhrzeit des Schulbeginns	0	0	0
2	2.4.1	Schulbusse im ländlichen Raum sind schwerer zu koordinieren, wenn der Schulbeginn nicht einheitlich wäre	Umstellung der Schulbusse auf dem Land wäre problematisch	3	2	2.5
2	2.4.1	Das wäre eine logistische Hürde, denn viele Schulbusse würden ihre Routen und Abfahrtzeiten umplanen müssen, was nicht reibungslos geschehen würde	Umstellung der Schulbusse auf dem Land wäre problematisch	2	2	2
2	2.3.1	Die Kinder schlafen mehr und sie sind nicht so oft verspätet. Die Kinder konyentrieren sich besser.	In der Pubertät werden viele Jugendliche zu Spättypen und brauchen morgens länger Schlaf	1	0	0.5
2	2.4.3	Die Freizeit am Nachmittag ist für Studenten sehr wichtig	Schüler:innen hätten weniger Freizeit am Nachmittag zur Verfügung	2	3	2.5
2	2.4.2	Der freie Nachmittag ist für die Studenten noch wichtiger, als das späte Aufstehen.	Mit späterem Schulanfang hört die Schule auch später auf	1	0	0.5
2	2.4.3	Die Schüler müssen bis später am Tag bleiben und zwischen den Unterrichtsstunden ein Mittagessen erhalten	Schüler:innen hätten weniger Freizeit am Nachmittag zur Verfügung	0	0	0
2	2.3.4	Schüler in der Pubertät sind tendenziell eher Spättypen, denen der frühe Schulanfang schwer fällt	Bei späterem Schulbeginn können Fehlzeiten weniger werden	0	0	0
2	2.4.2	Fahrplanprobleme mit Schulbus	Mit späterem Schulanfang hört die Schule auch später auf	0	0	0
2	2.4.3	Nachmittags länger in der Schule bleiben	Schüler:innen hätten weniger Freizeit am Nachmittag zur Verfügung	2	0	1
2	2.4.5	Schüler werden abends später müde und brauchen morgens mehr Schlaf.	Tageslicht hat einen größeren Einfluss auf die Leistungsfähigkeit als die Uhrzeit des Schulbeginns	0	0	0
2	2.3.4	Mehr Schlaf, bessere Leistungen, weniger Fehlzeiten.	Bei späterem Schulbeginn können Fehlzeiten weniger werden	2	2	2
2	2.4.3	Frühes Aufstehen verursacht keine Probleme für frühe Typen	Schüler:innen hätten weniger Freizeit am Nachmittag zur Verfügung	0	0	0
2	2.4.5	Nicht jeder braucht eine solche Verlängerung des Schlafes.	Tageslicht hat einen größeren Einfluss auf die Leistungsfähigkeit als die Uhrzeit des Schulbeginns	0	0	0
2	2.4.4	Es würde weniger Freizeit am Nachmittag zur Verfügung stehen, was nicht beliebt ist	Schulen müssten bei späteren Schulzeiten Mittagsversorgung anbieten	0	0	0
2	2.3.3	Die innere Uhr ändert sich bei vielen Menschen während der Pubertät - in Richtung des späten Typs.	US-Studie zeigt Vorteile des späteren Schulanfangs	0	0	0
