topic_id	ref_id	s1	s2	anno_1	anno_2	anno_average
2	2.4.1	1 bis 6 Klässler haben sich in einer Studie gegen den späteren freien Nachmittag ausgesprochen	Umstellung der Schulbusse auf dem Land wäre problematisch	0	0	0
2	2.3.2	Pubertät lässt viele zu Spätaufstehertyp werden	Schlafmangel hat einen negativen Einfluss auf die Konzentration und Schulleistung	0	0	0
2	2.4.2	die Zeitplanung der Schulbusse wird erheblich erschwert	Mit späterem Schulanfang hört die Schule auch später auf	0	0	0
2	2.3.3	Für viele Jugendliche ist das frühe Aufstehen zur Schulzeit eine Qual.	US-Studie zeigt Vorteile des späteren Schulanfangs	0	0	0
2	2.3.4	Eine Studie aus Seattle zeigte dass bei einem späteren Schulstart Schüler länger schlafen konnten und Fehlzeiten reduziert worden	Bei späterem Schulbeginn können Fehlzeiten weniger werden	2	2	2
2	2.4.3	Ein späterer Schulbeginn bedeutet, dass Nachmittags auch noch gearbeitet wird	Schüler:innen hätten weniger Freizeit am Nachmittag zur Verfügung	2	0	1
2	2.4.3	Spätere Lektionen sind kürzere freie Nachmittage für Schüler.	Schüler:innen hätten weniger Freizeit am Nachmittag zur Verfügung	2	2	2
2	2.1.1	Ist es eine gute Idee, die Startzeit der Klasse zu ändern?	Soll die Schule morgens später anfangen?	2	3	2.5
2	2.1.1	Die Frage ob ein späterer Schulbeginn sinnvoll ist.	Soll die Schule morgens später anfangen?	4	4	4
2	2.3.2	Schlafmangel schränkt Leistungsfähigkeit und Konzentration der Schüler ein	Schlafmangel hat einen negativen Einfluss auf die Konzentration und Schulleistung	4	4	4
2	2.3.3	Bessere Leistung der Schüler	US-Studie zeigt Vorteile des späteren Schulanfangs	0	0	0
2	2.4.1	der Unterricht geht bis in den Mittag, Betreuung und Verpflegung sind notwendig	Umstellung der Schulbusse auf dem Land wäre problematisch	0	0	0
2	2.4.1	Andererseits verlassen sie die Schule nicht gerne später.	Umstellung der Schulbusse auf dem Land wäre problematisch	0	0	0
2	2.4.2	Ein späterer Schulanfang würde ein Problem für die Schulbusse sein.	Mit späterem Schulanfang hört die Schule auch später auf	0	0	0
2	2.3.1	Die Fehlzeiten sind geringer.	In der Pubertät werden viele Jugendliche zu Spättypen und brauchen morgens länger Schlaf	0	0	0
2	2.3.1	bessere Konzentration	In der Pubertät werden viele Jugendliche zu Spättypen und brauchen morgens länger Schlaf	0	0	0
2	2.4.3	Diskrepanzen zwischen den Schulen	Schüler:innen hätten weniger Freizeit am Nachmittag zur Verfügung	0	0	0
2	2.4.2	Diskrepanzen zwischen den Schulen	Mit späterem Schulanfang hört die Schule auch später auf	0	0	0
2	2.3.1	In der Pupertaet aendern sich viele Menschen zum Spaettyp	In der Pubertät werden viele Jugendliche zu Spättypen und brauchen morgens länger Schlaf	3	3	3
2	2.4.3	Frühtypen macht das frühe Aufstehen kein Problem	Schüler:innen hätten weniger Freizeit am Nachmittag zur Verfügung	0	0	0
2	2.3.2	Verbessert die Konzentration. Die Leistung der Schüler ist besser.	Schlafmangel hat einen negativen Einfluss auf die Konzentration und Schulleistung	2	2	2
2	2.3.3	Die Konzentration der Schüler verbesserte sich	US-Studie zeigt Vorteile des späteren Schulanfangs	0	0	0
2	2.4.1	Der Schultag würde sich bis in die Mittagszeit erstrecken, so dass jede Schule eine eigene Kantine bereitstellen müsste.	Umstellung der Schulbusse auf dem Land wäre problematisch	0	0	0
2	2.3.2	Schlafmangel führt zu Konzentrations- und Leistungsschwächen und schlechter Laune	Schlafmangel hat einen negativen Einfluss auf die Konzentration und Schulleistung	3	4	3.5
2	2.3.1	Mehr Schlaf würde die Leistungsfähigkeit erhöhen	In der Pubertät werden viele Jugendliche zu Spättypen und brauchen morgens länger Schlaf	0	0	0
2	2.3.4	längerer Schlaf	Bei späterem Schulbeginn können Fehlzeiten weniger werden	0	0	0
2	2.3.2	bessere Konzentration	Schlafmangel hat einen negativen Einfluss auf die Konzentration und Schulleistung	1	2	1.5
2	2.4.4	Nicht jeder braucht eine solche Verlängerung des Schlafes.	Schulen müssten bei späteren Schulzeiten Mittagsversorgung anbieten	0	0	0
2	2.4.3	Weniger Tageslicht im Winter	Schüler:innen hätten weniger Freizeit am Nachmittag zur Verfügung	0	0	0
2	2.1.1	Ist ein späterer Schulbeginn sinnvoll?	Soll die Schule morgens später anfangen?	4	4	4
2	2.4.3	Schulbusse auf dem Land	Schüler:innen hätten weniger Freizeit am Nachmittag zur Verfügung	0	0	0
2	2.3.1	längerer Schlaf	In der Pubertät werden viele Jugendliche zu Spättypen und brauchen morgens länger Schlaf	1	1	1
2	2.4.5	Wenn einige Schüler später zur Schule gehen wollten, würde dies den Schulbussen Probleme bereiten.	Tageslicht hat einen größeren Einfluss auf die Leistungsfähigkeit als die Uhrzeit des Schulbeginns	0	0	0
2	2.3.2	Je nach Stadt/Bundesland müssen Schüler noch früher für die Fahrt zur Schule aufstehen.	Schlafmangel hat einen negativen Einfluss auf die Konzentration und Schulleistung	0	0	0
2	2.4.4	1 bis 6 Klässler haben sich in einer Studie gegen den späteren freien Nachmittag ausgesprochen	Schulen müssten bei späteren Schulzeiten Mittagsversorgung anbieten	0	0	0
2	2.4.2	der Unterricht muss auch Mittags und Nachmittags stattfinden, man muss Mittags Essen anbieten	Mit späterem Schulanfang hört die Schule auch später auf	0	2	1
2	2.4.5	Für Schulbusse wären unterschiedliche Zeiten problematisch	Tageslicht hat einen größeren Einfluss auf die Leistungsfähigkeit als die Uhrzeit des Schulbeginns	0	0	0
2	2.3.3	Zum einen fangen Kinder gerne etwas später an, sie können dann länger schlafen.	US-Studie zeigt Vorteile des späteren Schulanfangs	0	0	0
2	2.4.3	Die Schüler ziehen es vor, den Unterricht früher zu beginnen, um ein späteres Ende zu vermeiden.	Schüler:innen hätten weniger Freizeit am Nachmittag zur Verfügung	1	1	1
2	2.4.1	Busprobleme	Umstellung der Schulbusse auf dem Land wäre problematisch	2	3	2.5
2	2.4.5	Frühtypen macht das frühe Aufstehen kein Problem	Tageslicht hat einen größeren Einfluss auf die Leistungsfähigkeit als die Uhrzeit des Schulbeginns	0	0	0
2	2.3.3	Die Fehlzeiten sind geringer.	US-Studie zeigt Vorteile des späteren Schulanfangs	0	0	0
2	2.4.3	Schulbusse die für Schulen mit unterschiedlichem Schulbeginn eingesetzt werden, lassen sich schlecht planen	Schüler:innen hätten weniger Freizeit am Nachmittag zur Verfügung	0	0	0
2	2.3.3	Viele Schüler sind Nachttypen, die aus biologischer Sicht morgens länger schlafen müssen.	US-Studie zeigt Vorteile des späteren Schulanfangs	0	0	0
2	2.4.5	Die Schüler sollten den Nachmittag über aktiv bleiben, damit sie früh schlafen können	Tageslicht hat einen größeren Einfluss auf die Leistungsfähigkeit als die Uhrzeit des Schulbeginns	0	0	0
2	2.4.4	Spätere Lektionen sind kürzere freie Nachmittage für Schüler.	Schulen müssten bei späteren Schulzeiten Mittagsversorgung anbieten	0	0	0
2	2.4.4	Schueler koennten nicht mit dem Bus zur Schule	Schulen müssten bei späteren Schulzeiten Mittagsversorgung anbieten	0	0	0
2	2.4.3	Schulbusse im ländlichen Raum sind schwerer zu koordinieren, wenn der Schulbeginn nicht einheitlich wäre	Schüler:innen hätten weniger Freizeit am Nachmittag zur Verfügung	0	0	0
2	2.3.1	Bessere Leistung der Schüler	In der Pubertät werden viele Jugendliche zu Spättypen und brauchen morgens länger Schlaf	0	0	0
2	2.3.4	Die Fehlzeiten wären geringer	Bei späterem Schulbeginn können Fehlzeiten weniger werden	3	3	3
2	2.3.1	Sonnenlicht beeinflusst die Leistungsfähigkeit positiv	In der Pubertät werden viele Jugendliche zu Spättypen und brauchen morgens länger Schlaf	0	0	0
2	2.4.2	Die Schulen müssen das Mittagessen organisieren - der Unterricht wird zur Mittagszeit fortgesetzt	Mit späterem Schulanfang hört die Schule auch später auf	0	2	1
2	2.1.1	Wann sollte der Unterricht beginnen?	Soll die Schule morgens später anfangen?	1	3	2
2	2.4.3	Die Jugendlichen stehen schon schwer auf in der Früh. Der freie Nachmittag ist ihnen aber noch wichtiger, als das späte Aufstehen.	Schüler:innen hätten weniger Freizeit am Nachmittag zur Verfügung	2	0	1
2	2.4.3	Die Schulen müssen das Mittagessen organisieren - der Unterricht wird zur Mittagszeit fortgesetzt	Schüler:innen hätten weniger Freizeit am Nachmittag zur Verfügung	0	0	0
2	2.3.4	Verbesserte Leistungen	Bei späterem Schulbeginn können Fehlzeiten weniger werden	0	0	0
2	2.4.1	Uhrzeitstellung und länger im Dunkeln in der Schule sein	Umstellung der Schulbusse auf dem Land wäre problematisch	0	0	0
2	2.4.1	Wenn die Unterrichtsstunden zu unterschiedlichen Zeiten beginnen, ist es schwieriger, den Transport der Schüler zu organisieren.	Umstellung der Schulbusse auf dem Land wäre problematisch	2	3	2.5
2	2.3.3	Spättypen: Schlafmangel wenn Beginn um 8 Uhr	US-Studie zeigt Vorteile des späteren Schulanfangs	0	0	0
2	2.3.1	langer Traum	In der Pubertät werden viele Jugendliche zu Spättypen und brauchen morgens länger Schlaf	0	0	0
2	2.3.4	Mit dem späteren Schulbeginn haben die Schüler mehr Zeit zum Schlafen, wodurch sich ihre Leistung verbessert und die Fehlzeiten verringert werden	Bei späterem Schulbeginn können Fehlzeiten weniger werden	2	0	1
2	2.3.4	Fruehaufstehn ist fuer Judendliche eine Qual	Bei späterem Schulbeginn können Fehlzeiten weniger werden	0	0	0
2	2.4.2	zurück in die Dunkelheit	Mit späterem Schulanfang hört die Schule auch später auf	0	0	0
2	2.4.2	Wenn die Schüler nachmittags draussen sich austoben können sie besser schlafen.	Mit späterem Schulanfang hört die Schule auch später auf	0	0	0
2	2.4.4	Schulbusse müssen mehrere Schulen anfahren, wenn alle unterschiedliche Startzeiten haben, müssten Busse mehrfach fahren (Zeiten passen nicht mehr zusammen)	Schulen müssten bei späteren Schulzeiten Mittagsversorgung anbieten	0	0	0
2	2.4.2	Organisatorische Probleme wie Schulbusse und Mittagsbetreuung	Mit späterem Schulanfang hört die Schule auch später auf	0	0	0
2	2.3.1	Frühtypen wird das frühe Aufstehen eher keine Probleme machen	In der Pubertät werden viele Jugendliche zu Spättypen und brauchen morgens länger Schlaf	0	0	0
2	2.4.1	Weniger Tageslicht im Winter	Umstellung der Schulbusse auf dem Land wäre problematisch	0	0	0
2	2.4.2	Schulunterricht wuerde Nachmittags sein	Mit späterem Schulanfang hört die Schule auch später auf	1	2	1.5
2	2.3.4	Schlafmangel schränkt die Leistungsfähigkeit ein, führt zu Konzentrations- und Ausdauerstörungen und macht schlechte Laune	Bei späterem Schulbeginn können Fehlzeiten weniger werden	0	0	0
2	2.4.2	Es kann chaotisch sein, den Fahrplan der Schulbusse zu organisieren, wenn die Schulen unterschiedliche Startzeiten haben.	Mit späterem Schulanfang hört die Schule auch später auf	0	0	0
2	2.4.4	freie Nachmittage fallen weg	Schulen müssten bei späteren Schulzeiten Mittagsversorgung anbieten	0	0	0
2	2.4.4	Der freie Nachmittag ist für die Studenten noch wichtiger, als das späte Aufstehen.	Schulen müssten bei späteren Schulzeiten Mittagsversorgung anbieten	0	0	0
2	2.3.3	Dies würde die Konzentration steigern	US-Studie zeigt Vorteile des späteren Schulanfangs	0	0	0
2	2.3.4	Die Kinder schlafen mehr und sie sind nicht so oft verspätet. Die Kinder konyentrieren sich besser.	Bei späterem Schulbeginn können Fehlzeiten weniger werden	1	2	1.5
2	2.3.4	es wurde dokumentiert, dass die Schüler nach dem späteren aufstehen konzentrierter sind und das sich ihre Leistungsfähigkeit verbessert	Bei späterem Schulbeginn können Fehlzeiten weniger werden	0	0	0
2	2.3.2	Ausgeschlafene Schüler können sich besser konzentrieren.	Schlafmangel hat einen negativen Einfluss auf die Konzentration und Schulleistung	2	3	2.5
2	2.3.2	Für viele Jugendliche ist das frühe Aufstehen zur Schulzeit eine Qual.	Schlafmangel hat einen negativen Einfluss auf die Konzentration und Schulleistung	0	0	0
2	2.4.4	Die Schulbusse fahren oft mehrere Schulen ab und das führt bei unterschiedlichem Unterrichtsbeginn zu Problemen.	Schulen müssten bei späteren Schulzeiten Mittagsversorgung anbieten	0	0	0
2	2.3.1	Wenn es für eine perrmanente Sommerzeit entschieden wird, dann müssten Schüler später die Schule beginnen, denn das Tageslicht ist wicthig für die Leistungsfähigkeit.	In der Pubertät werden viele Jugendliche zu Spättypen und brauchen morgens länger Schlaf	0	0	0
2	2.3.3	Schüler in der Pubertät sind tendenziell eher Spättypen, denen der frühe Schulanfang schwer fällt	US-Studie zeigt Vorteile des späteren Schulanfangs	0	0	0
2	2.1.1	Wäre es besser, wenn die Schule später beginnen würde?	Soll die Schule morgens später anfangen?	4	3	3.5
2	2.4.5	Längere Unterrichtsstunden beeinträchtigen die Mittagspause.	Tageslicht hat einen größeren Einfluss auf die Leistungsfähigkeit als die Uhrzeit des Schulbeginns	0	0	0
2	2.3.2	Die Fehlzeiten sind geringer.	Schlafmangel hat einen negativen Einfluss auf die Konzentration und Schulleistung	0	0	0
2	2.3.4	insgesamt weniger Fehltage, mehr Motivation	Bei späterem Schulbeginn können Fehlzeiten weniger werden	2	2	2
2	2.4.5	Schule endet später, somit kein freier Nachmittag mehr	Tageslicht hat einen größeren Einfluss auf die Leistungsfähigkeit als die Uhrzeit des Schulbeginns	0	0	0
2	2.4.1	die Schüle würde später aufhören	Umstellung der Schulbusse auf dem Land wäre problematisch	0	0	0
2	2.4.4	Studenten und Professoren müssten den Unterricht nach der Mittagspause fortsetzen	Schulen müssten bei späteren Schulzeiten Mittagsversorgung anbieten	0	0	0
2	2.4.3	die Zeitplanung der Schulbusse wird erheblich erschwert	Schüler:innen hätten weniger Freizeit am Nachmittag zur Verfügung	0	0	0
2	2.3.3	das frühe Aufstehen zur Schulzeit sei eine Qual	US-Studie zeigt Vorteile des späteren Schulanfangs	0	0	0
2	2.4.4	Umstellung für Schulbusse vor allem auf dem Land	Schulen müssten bei späteren Schulzeiten Mittagsversorgung anbieten	0	0	0
2	2.4.3	Der freie Nachmittag ist für die Studenten noch wichtiger, als das späte Aufstehen.	Schüler:innen hätten weniger Freizeit am Nachmittag zur Verfügung	2	2	2
2	2.3.3	Der Schlafmangel schränkt die Leistung der Schüler ein und beeinflusst so ihre Stimmung negativ	US-Studie zeigt Vorteile des späteren Schulanfangs	0	0	0
2	2.3.1	Schlafmangel schränkt Leistungsfähigkeit ein, Konzentrations- & Ausdauerstörungen, schlechte Laune	In der Pubertät werden viele Jugendliche zu Spättypen und brauchen morgens länger Schlaf	0	0	0
2	2.4.3	Tageslicht spielt eine große Rolle	Schüler:innen hätten weniger Freizeit am Nachmittag zur Verfügung	0	0	0
2	2.3.1	der Absentismus von Schülern kann sinken	In der Pubertät werden viele Jugendliche zu Spättypen und brauchen morgens länger Schlaf	0	0	0
2	2.3.4	Tageslicht hilft den Schülern, produktiv zu sein	Bei späterem Schulbeginn können Fehlzeiten weniger werden	0	0	0
2	2.4.3	Probleme mit den Schulbussen, vor allem auf dem Land	Schüler:innen hätten weniger Freizeit am Nachmittag zur Verfügung	0	0	0
2	2.4.2	Wenn einige Schüler später zur Schule gehen wollten, würde dies den Schulbussen Probleme bereiten.	Mit späterem Schulanfang hört die Schule auch später auf	0	0	0
2	2.4.5	Das Schulbussystem zu reorganisieren, wenn die Schüler alle zu unterschiedlichen Zeiten beginnen.	Tageslicht hat einen größeren Einfluss auf die Leistungsfähigkeit als die Uhrzeit des Schulbeginns	0	0	0
2	2.3.3	Mit den Entwicklung, verschiebt sich der biologische Zyklus in Richtung späteres Schlafengehen, sodass die Schüler können wieder wettmachen, indem sie später am Morgen aufstehen.	US-Studie zeigt Vorteile des späteren Schulanfangs	0	0	0
2	2.4.1	Die Schulen müssen das Mittagessen organisieren - der Unterricht wird zur Mittagszeit fortgesetzt	Umstellung der Schulbusse auf dem Land wäre problematisch	0	0	0
2	2.3.4	Dabei spielt das Tageslicht eine entscheidende Rolle für die Leistungsfähigkeit	Bei späterem Schulbeginn können Fehlzeiten weniger werden	0	0	0
2	2.4.4	Andererseits verlassen sie die Schule nicht gerne später.	Schulen müssten bei späteren Schulzeiten Mittagsversorgung anbieten	0	0	0
2	2.4.1	Problematik der Schulbüsse	Umstellung der Schulbusse auf dem Land wäre problematisch	2	3	2.5
2	2.3.3	höhere Leistungsfähigkeit durch Arbeiten bei mehr Tageslicht	US-Studie zeigt Vorteile des späteren Schulanfangs	0	0	0
2	2.4.4	Schulbusse auf dem Land	Schulen müssten bei späteren Schulzeiten Mittagsversorgung anbieten	0	0	0
2	2.3.3	Studie zeigt: Leistungen verbesserten sich und die Fehlzeiten waren geringer	US-Studie zeigt Vorteile des späteren Schulanfangs	2	3	2.5
2	2.4.4	Ein späterer Schulbeginn bedeutet auch, dass man in die Mittagszeit hineinkommt.	Schulen müssten bei späteren Schulzeiten Mittagsversorgung anbieten	1	1	1
2	2.3.2	Wenn es für eine perrmanente Sommerzeit entschieden wird, dann müssten Schüler später die Schule beginnen, denn das Tageslicht ist wicthig für die Leistungsfähigkeit.	Schlafmangel hat einen negativen Einfluss auf die Konzentration und Schulleistung	0	0	0
2	2.4.2	Schule endet später, somit kein freier Nachmittag mehr	Mit späterem Schulanfang hört die Schule auch später auf	2	3	2.5
2	2.1.1	Soll der Schulbeginn auf später verlegt werden?	Soll die Schule morgens später anfangen?	4	4	4
2	2.4.5	Organisatorische Probleme wie Schulbusse und Mittagsbetreuung	Tageslicht hat einen größeren Einfluss auf die Leistungsfähigkeit als die Uhrzeit des Schulbeginns	0	0	0
2	2.3.3	Jugendliche brauchen morgens länger Schlaf um Schlafmangel zu vermeiden.	US-Studie zeigt Vorteile des späteren Schulanfangs	0	0	0
2	2.4.2	man braucht Mittagsversorgung und Pause und muss hinterher erneut Unterricht machen	Mit späterem Schulanfang hört die Schule auch später auf	0	2	1
2	2.4.3	Umstellung für Schulbusse vor allem auf dem Land	Schüler:innen hätten weniger Freizeit am Nachmittag zur Verfügung	0	0	0
2	2.3.2	später erzielen die Schüler bessere Ergebnisse	Schlafmangel hat einen negativen Einfluss auf die Konzentration und Schulleistung	1	1	1
2	2.4.4	Längere Unterrichtsstunden beeinträchtigen die Mittagspause.	Schulen müssten bei späteren Schulzeiten Mittagsversorgung anbieten	1	1	1
2	2.3.1	Eine Studie aus Seattle zeigte dass bei einem späteren Schulstart Schüler länger schlafen konnten und Fehlzeiten reduziert worden	In der Pubertät werden viele Jugendliche zu Spättypen und brauchen morgens länger Schlaf	0	0	0
2	2.4.4	Die Schule endet später.	Schulen müssten bei späteren Schulzeiten Mittagsversorgung anbieten	0	0	0
2	2.3.4	Die Schüler schlafen an freien Wochenenden länger.	Bei späterem Schulbeginn können Fehlzeiten weniger werden	0	0	0
2	2.4.5	späterer Nachmittag, weniger unter dem Sonnenlicht	Tageslicht hat einen größeren Einfluss auf die Leistungsfähigkeit als die Uhrzeit des Schulbeginns	0	1	0.5
2	2.4.5	Im Winter, wenn es früher dunkel wird, müssten die Schüler länger ohne Sonne und helles Licht bleiben.	Tageslicht hat einen größeren Einfluss auf die Leistungsfähigkeit als die Uhrzeit des Schulbeginns	0	1	0.5
2	2.4.2	Tageslicht spielt eine große Rolle	Mit späterem Schulanfang hört die Schule auch später auf	0	0	0
2	2.4.4	Der Transport (durch Schulbusse) wird beeinträchtigt.	Schulen müssten bei späteren Schulzeiten Mittagsversorgung anbieten	0	0	0
2	2.4.2	Busse, die die Schüler zur Schule bringen, müssten zu unterschiedlichen Zeiten fahren, was problematisch ist	Mit späterem Schulanfang hört die Schule auch später auf	0	0	0
2	2.3.4	Mehr Schlaf führt zu einer Verbesserung der Leistungsfähigkeit.	Bei späterem Schulbeginn können Fehlzeiten weniger werden	0	0	0
2	2.4.1	Längere Unterrichtsstunden beeinträchtigen die Mittagspause.	Umstellung der Schulbusse auf dem Land wäre problematisch	0	0	0
2	2.3.4	Die Schüler hatten bessere Ergebnisse in der Schule	Bei späterem Schulbeginn können Fehlzeiten weniger werden	0	0	0
2	2.4.2	Frühtypen wird es nicht (oder negativ) beeinflussen.	Mit späterem Schulanfang hört die Schule auch später auf	0	0	0
2	2.4.5	Mittagsversorgung müsste angeboten werden	Tageslicht hat einen größeren Einfluss auf die Leistungsfähigkeit als die Uhrzeit des Schulbeginns	0	0	0
2	2.1.1	Wiw sinnvoll wäre eine Umstellung des Schuhlbeginns am Morgen	Soll die Schule morgens später anfangen?	2	3	2.5
2	2.3.4	Findet Zustimmung bei den Schüler/innen.	Bei späterem Schulbeginn können Fehlzeiten weniger werden	0	0	0
2	2.3.2	die innere Uhr verändert sich in der Pubertät, die Jugendlichen gehen später schlafen und "müssen" demnach später aufstehen -> Schlafmangel schränkt die Leistungsfähigkeit ein, führt zu Konzentrations- und Ausdauerstörungen und macht schlechte Laune	Schlafmangel hat einen negativen Einfluss auf die Konzentration und Schulleistung	2	2	2
2	2.3.3	In der Pubertät werden Schüler zu Spättypen, sie brauchen den Schlaf	US-Studie zeigt Vorteile des späteren Schulanfangs	0	0	0
2	2.4.3	Die Schüler wollen lieber früh schluss haben als spät anfangen.	Schüler:innen hätten weniger Freizeit am Nachmittag zur Verfügung	2	1	1.5
2	2.4.4	Späteres Schulende, teilweise bis 14 Uhr	Schulen müssten bei späteren Schulzeiten Mittagsversorgung anbieten	0	0	0
2	2.3.2	das frühe Aufstehen zur Schulzeit sei eine Qual	Schlafmangel hat einen negativen Einfluss auf die Konzentration und Schulleistung	0	0	0
2	2.4.2	Frühtypen macht das frühe Aufstehen kein Problem	Mit späterem Schulanfang hört die Schule auch später auf	0	0	0
2	2.4.5	Freier Nachmittag ist wichtiger als späteres Aufstehen.	Tageslicht hat einen größeren Einfluss auf die Leistungsfähigkeit als die Uhrzeit des Schulbeginns	0	0	0
2	2.1.1	Mögliche Verschiebung des Schulbeginns auf spätere Uhrzeit	Soll die Schule morgens später anfangen?	2	3	2.5
2	2.4.3	Führt zu Problemen bei der Zeitumstellung	Schüler:innen hätten weniger Freizeit am Nachmittag zur Verfügung	0	0	0
2	2.4.1	Der Unterricht würde auch nach der Mittagspause stattfinden	Umstellung der Schulbusse auf dem Land wäre problematisch	0	0	0
2	2.3.3	Schüler würden mehr Zeit während des Tageslichtes verbringen	US-Studie zeigt Vorteile des späteren Schulanfangs	0	0	0
2	2.3.4	Jugendliche brauchen morgens länger Schlaf um Schlafmangel zu vermeiden.	Bei späterem Schulbeginn können Fehlzeiten weniger werden	0	0	0
2	2.1.1	Schulbeginn um 8 Uhr sinnvoll	Soll die Schule morgens später anfangen?	2	3	2.5
2	2.1.1	ob es sinnvoll ist, die Schule später zu beginnen	Soll die Schule morgens später anfangen?	4	4	4
2	2.3.3	der Schlafmangel mindert Leistungsfähigkeit	US-Studie zeigt Vorteile des späteren Schulanfangs	0	0	0
2	2.3.3	Konzentration verbessert sich nachweislich (siehe Beispiel Seattle) durch mehr Schlaf in Verbindung mit dem späteren Schulstart	US-Studie zeigt Vorteile des späteren Schulanfangs	2	2	2
2	2.3.1	die innere Uhr verändert sich in der Pubertät, die Jugendlichen gehen später schlafen und "müssen" demnach später aufstehen -> Schlafmangel schränkt die Leistungsfähigkeit ein, führt zu Konzentrations- und Ausdauerstörungen und macht schlechte Laune	In der Pubertät werden viele Jugendliche zu Spättypen und brauchen morgens länger Schlaf	2	2	2
2	2.4.1	SuS wären länger in der Schule --> freier Nachmittag ist ihnen wichtiger, als spätes Aufstehen	Umstellung der Schulbusse auf dem Land wäre problematisch	0	0	0
2	2.1.1	Schulbeginn um 8 Uhr sinnvoll?	Soll die Schule morgens später anfangen?	2	3	2.5
2	2.3.1	Die innere Uhr ändert sich bei vielen Menschen während der Pubertät - in Richtung des späten Typs.	In der Pubertät werden viele Jugendliche zu Spättypen und brauchen morgens länger Schlaf	2	3	2.5
2	2.4.5	Würde die halbjährliche Zeitumstellung entfallen, würden die Schüler nach Einbruch der Dunkelheit mehr Zeit in der Schule verbringen.	Tageslicht hat einen größeren Einfluss auf die Leistungsfähigkeit als die Uhrzeit des Schulbeginns	1	1	1
2	2.4.1	Freier Nachmittag ist wichtiger als späteres Aufstehen.	Umstellung der Schulbusse auf dem Land wäre problematisch	0	0	0
2	2.3.4	Die biologische Uhr der Jugend ist darauf eingestellt, später aufzustehen.	Bei späterem Schulbeginn können Fehlzeiten weniger werden	0	0	0
2	2.1.1	War es besser, später in den Tag die Stunden zu starten?	Soll die Schule morgens später anfangen?	2	3	2.5
2	2.3.2	Bessere Leistung der Schüler	Schlafmangel hat einen negativen Einfluss auf die Konzentration und Schulleistung	1	2	1.5
2	2.4.3	eine Mittagsversorgung müsste eingerichtet werden, danach gäbe es noch weiteren Unterricht-wenig Akzeptanz dieser Idee	Schüler:innen hätten weniger Freizeit am Nachmittag zur Verfügung	1	1	1
2	2.4.3	nach der Mittagspause noch mal Unterricht machen. Das findet wenig Akzeptanz	Schüler:innen hätten weniger Freizeit am Nachmittag zur Verfügung	1	1	1
2	2.4.5	Die Schulbusse sind nicht fur alle da	Tageslicht hat einen größeren Einfluss auf die Leistungsfähigkeit als die Uhrzeit des Schulbeginns	0	0	0
2	2.4.4	Frühes Aufstehen verursacht keine Probleme für frühe Typen	Schulen müssten bei späteren Schulzeiten Mittagsversorgung anbieten	0	0	0
2	2.4.5	Die Schulbusse fahren oft mehrere Schulen ab und das führt bei unterschiedlichem Unterrichtsbeginn zu Problemen.	Tageslicht hat einen größeren Einfluss auf die Leistungsfähigkeit als die Uhrzeit des Schulbeginns	0	0	0
2	2.3.1	längerer Schlaf, bessere Leistung, weniger Fehlzeiten	In der Pubertät werden viele Jugendliche zu Spättypen und brauchen morgens länger Schlaf	2	1	1.5
2	2.4.5	Wenn der Unterricht später beginnt, muss er später enden - die Schüler mögen es nicht	Tageslicht hat einen größeren Einfluss auf die Leistungsfähigkeit als die Uhrzeit des Schulbeginns	0	0	0
2	2.3.2	Konzentration verbessert sich	Schlafmangel hat einen negativen Einfluss auf die Konzentration und Schulleistung	2	2	2
2	2.3.1	Ihre Noten verbessern sich.	In der Pubertät werden viele Jugendliche zu Spättypen und brauchen morgens länger Schlaf	0	0	0
